name,address,website,phone_number,reviews_count,reviews_average
Museum Satriamandala,"Jl. Gatot Subroto No.14, RT.6/RW.1, Kuningan Bar., Kec. Mampang Prpt., Kota Jakarta Selatan, Daerah Khusus Ibukota Jakarta 12710",sejarah-tni.mil.id,0813-1947-1139,(7.683),(7.683)
MOJA Museum,"Komplek Gelora Bung Karno Main Stadium, Jl. Gerbang Pemuda No.1, RT.1/RW.3, Gelora, Daerah Khusus Ibukota Jakarta 10270",mojamuseum.com,0822-7300-0730,(2.150),(2.150)
Museum Polri,"Jl. Trunojoyo No.3, RT.5/RW.2, Selong, Kec. Kby. Baru, Kota Jakarta Selatan, Daerah Khusus Ibukota Jakarta 12110",museumpolri.org,0821-1631-7799,(686),(686)
Museum Kehutanan Manggala Wanabakti,"QQVX+6C5, RT.1/RW.3, Gelora, Kecamatan Tanah Abang, Kota Jakarta Pusat, Daerah Khusus Ibukota Jakarta 10270",muspera.menlhk.go.id,,(196),(196)
Museum Sasmitaloka Jenderal Besar Dr. A. H. Nasution,"Jl. Teuku Umar No.40, RT.1/RW.1, Gondangdia, Kec. Menteng, Kota Jakarta Pusat, Daerah Khusus Ibukota Jakarta 10350",,,(1.029),(1.029)
Museum DPR RI,"DPR-RI, Gedung Nusantara, Jl. Gatot Subroto, Gelora, Kecamatan Tanah Abang, Kota Jakarta Pusat, Daerah Khusus Ibukota Jakarta 10270",,(021) 5715625,(30),(30)
